{
  "schemaVersion": "1.0.0",
  "generatedAt": "2026-10-01T11:00:31.000Z",
  "distributionId": "opensuse-leap",
  "collections": [
    {
      "id": "pattern:32bit",
      "sourceId": "32bit",
      "type": "pattern",
      "names": {
        "en": "32bit"
      },
      "descriptions": {},
      "visible": true,
      "default": false,
      "installTarget": "32bit",
      "members": [],
      "children": []
    },
    {
      "id": "pattern:apparmor",
      "sourceId": "apparmor",
      "type": "pattern",
      "names": {
        "en": "apparmor"
      },
      "descriptions": {},
      "visible": true,
      "default": false,
      "installTarget": "apparmor",
      "members": [],
      "children": []
    },
    {
      "id": "pattern:base",
      "sourceId": "base",
      "type": "pattern",
      "names": {
        "en": "base"
      },
      "descriptions": {},
      "visible": true,
      "default": false,
      "installTarget": "base",
      "members": [],
      "children": []
    },
    {
      "id": "pattern:basic_desktop",
      "sourceId": "basic_desktop",
      "type": "pattern",
      "names": {
        "en": "basic_desktop"
      },
      "descriptions": {},
      "visible": true,
      "default": false,
      "installTarget": "basic_desktop",
      "members": [],
      "children": []
    },
    {
      "id": "pattern:books",
      "sourceId": "books",
      "type": "pattern",
      "names": {
        "en": "books"
      },
      "descriptions": {},
      "visible": true,
      "default": false,
      "installTarget": "books",
      "members": [],
      "children": []
    },
    {
      "id": "pattern:budgie",
      "sourceId": "budgie",
      "type": "pattern",
      "names": {
        "en": "budgie"
      },
      "descriptions": {},
      "visible": true,
      "default": false,
      "installTarget": "budgie",
      "members": [],
      "children": []
    },
    {
      "id": "pattern:budgie_applets",
      "sourceId": "budgie_applets",
      "type": "pattern",
      "names": {
        "en": "budgie_applets"
      },
      "descriptions": {},
      "visible": true,
      "default": false,
      "installTarget": "budgie_applets",
      "members": [],
      "children": []
    },
    {
      "id": "pattern:cinnamon",
      "sourceId": "cinnamon",
      "type": "pattern",
      "names": {
        "en": "cinnamon"
      },
      "descriptions": {},
      "visible": true,
      "default": false,
      "installTarget": "cinnamon",
      "members": [],
      "children": []
    },
    {
      "id": "pattern:cockpit",
      "sourceId": "cockpit",
      "type": "pattern",
      "names": {
        "en": "cockpit"
      },
      "descriptions": {},
      "visible": true,
      "default": false,
      "installTarget": "cockpit",
      "members": [],
      "children": []
    },
    {
      "id": "pattern:cockpit_client",
      "sourceId": "cockpit_client",
      "type": "pattern",
      "names": {
        "en": "cockpit_client"
      },
      "descriptions": {},
      "visible": true,
      "default": false,
      "installTarget": "cockpit_client",
      "members": [],
      "children": []
    },
    {
      "id": "pattern:console",
      "sourceId": "console",
      "type": "pattern",
      "names": {
        "en": "console"
      },
      "descriptions": {},
      "visible": true,
      "default": false,
      "installTarget": "console",
      "members": [],
      "children": []
    },
    {
      "id": "pattern:container_runtime_docker",
      "sourceId": "container_runtime_docker",
      "type": "pattern",
      "names": {
        "en": "container_runtime_docker"
      },
      "descriptions": {},
      "visible": true,
      "default": false,
      "installTarget": "container_runtime_docker",
      "members": [],
      "children": []
    },
    {
      "id": "pattern:devel_C_C++",
      "sourceId": "devel_C_C++",
      "type": "pattern",
      "names": {
        "en": "devel_C_C++"
      },
      "descriptions": {},
      "visible": true,
      "default": false,
      "installTarget": "devel_C_C++",
      "members": [],
      "children": []
    },
    {
      "id": "pattern:devel_basis",
      "sourceId": "devel_basis",
      "type": "pattern",
      "names": {
        "en": "devel_basis"
      },
      "descriptions": {},
      "visible": true,
      "default": false,
      "installTarget": "devel_basis",
      "members": [],
      "children": []
    },
    {
      "id": "pattern:devel_gnome",
      "sourceId": "devel_gnome",
      "type": "pattern",
      "names": {
        "en": "devel_gnome"
      },
      "descriptions": {},
      "visible": true,
      "default": false,
      "installTarget": "devel_gnome",
      "members": [],
      "children": []
    },
    {
      "id": "pattern:devel_kde_frameworks",
      "sourceId": "devel_kde_frameworks",
      "type": "pattern",
      "names": {
        "en": "devel_kde_frameworks"
      },
      "descriptions": {},
      "visible": true,
      "default": false,
      "installTarget": "devel_kde_frameworks",
      "members": [],
      "children": []
    },
    {
      "id": "pattern:devel_kde_frameworks6",
      "sourceId": "devel_kde_frameworks6",
      "type": "pattern",
      "names": {
        "en": "devel_kde_frameworks6"
      },
      "descriptions": {},
      "visible": true,
      "default": false,
      "installTarget": "devel_kde_frameworks6",
      "members": [],
      "children": []
    },
    {
      "id": "pattern:devel_kernel",
      "sourceId": "devel_kernel",
      "type": "pattern",
      "names": {
        "en": "devel_kernel"
      },
      "descriptions": {},
      "visible": true,
      "default": false,
      "installTarget": "devel_kernel",
      "members": [],
      "children": []
    },
    {
      "id": "pattern:devel_qt5",
      "sourceId": "devel_qt5",
      "type": "pattern",
      "names": {
        "en": "devel_qt5"
      },
      "descriptions": {},
      "visible": true,
      "default": false,
      "installTarget": "devel_qt5",
      "members": [],
      "children": []
    },
    {
      "id": "pattern:devel_qt6",
      "sourceId": "devel_qt6",
      "type": "pattern",
      "names": {
        "en": "devel_qt6"
      },
      "descriptions": {},
      "visible": true,
      "default": false,
      "installTarget": "devel_qt6",
      "members": [],
      "children": []
    },
    {
      "id": "pattern:devel_rpm_build",
      "sourceId": "devel_rpm_build",
      "type": "pattern",
      "names": {
        "en": "devel_rpm_build"
      },
      "descriptions": {},
      "visible": true,
      "default": false,
      "installTarget": "devel_rpm_build",
      "members": [],
      "children": []
    },
    {
      "id": "pattern:devel_vulkan",
      "sourceId": "devel_vulkan",
      "type": "pattern",
      "names": {
        "en": "devel_vulkan"
      },
      "descriptions": {},
      "visible": true,
      "default": false,
      "installTarget": "devel_vulkan",
      "members": [],
      "children": []
    },
    {
      "id": "pattern:devel_web",
      "sourceId": "devel_web",
      "type": "pattern",
      "names": {
        "en": "devel_web"
      },
      "descriptions": {},
      "visible": true,
      "default": false,
      "installTarget": "devel_web",
      "members": [],
      "children": []
    },
    {
      "id": "pattern:dhcp_dns_server",
      "sourceId": "dhcp_dns_server",
      "type": "pattern",
      "names": {
        "en": "dhcp_dns_server"
      },
      "descriptions": {},
      "visible": true,
      "default": false,
      "installTarget": "dhcp_dns_server",
      "members": [],
      "children": []
    },
    {
      "id": "pattern:directory_server",
      "sourceId": "directory_server",
      "type": "pattern",
      "names": {
        "en": "directory_server"
      },
      "descriptions": {},
      "visible": true,
      "default": false,
      "installTarget": "directory_server",
      "members": [],
      "children": []
    },
    {
      "id": "pattern:documentation",
      "sourceId": "documentation",
      "type": "pattern",
      "names": {
        "en": "documentation"
      },
      "descriptions": {},
      "visible": true,
      "default": false,
      "installTarget": "documentation",
      "members": [],
      "children": []
    },
    {
      "id": "pattern:enhanced_base",
      "sourceId": "enhanced_base",
      "type": "pattern",
      "names": {
        "en": "enhanced_base"
      },
      "descriptions": {},
      "visible": true,
      "default": false,
      "installTarget": "enhanced_base",
      "members": [],
      "children": []
    },
    {
      "id": "pattern:enlightenment",
      "sourceId": "enlightenment",
      "type": "pattern",
      "names": {
        "en": "enlightenment"
      },
      "descriptions": {},
      "visible": true,
      "default": false,
      "installTarget": "enlightenment",
      "members": [],
      "children": []
    },
    {
      "id": "pattern:file_server",
      "sourceId": "file_server",
      "type": "pattern",
      "names": {
        "en": "file_server"
      },
      "descriptions": {},
      "visible": true,
      "default": false,
      "installTarget": "file_server",
      "members": [],
      "children": []
    },
    {
      "id": "pattern:fips",
      "sourceId": "fips",
      "type": "pattern",
      "names": {
        "en": "fips"
      },
      "descriptions": {},
      "visible": true,
      "default": false,
      "installTarget": "fips",
      "members": [],
      "children": []
    },
    {
      "id": "pattern:fonts",
      "sourceId": "fonts",
      "type": "pattern",
      "names": {
        "en": "fonts"
      },
      "descriptions": {},
      "visible": true,
      "default": false,
      "installTarget": "fonts",
      "members": [],
      "children": []
    },
    {
      "id": "pattern:games",
      "sourceId": "games",
      "type": "pattern",
      "names": {
        "en": "games"
      },